"discrimination staff. just looking and judging the customer from they look. but the hotel is good, the view is nice, and food nice. please training your staff. just because we use shirt we cant stay at hyatt."
Overall very happy with the hotel and enjoyed our stay there. Would be nicer if our room is not so far to walk to and the noise from the room above us.  Good spread of choices of food at breakfast but the billing is quite confusing.
"Nice and excellences ambiances, green, quiet, nice swimming pool and perfect places for short golf games. Close proximity to Kaliurang and Merapi recreations destinations. Some nice restaurants available near the hotels."
"We love how hyatt treat us...  I Really enjoy with the spa. My son enjoy with the pool, fishing, bcycling, turtle feeding. And my husband really enjoy the ambience  Banyak yang bisa di lakukan disini, jalan2 pagi pun menyenangkan, rasanya hampir semua yang ada di jogja terwakili disini.  Our breakfast and dinner feels great.  "
"Great hotel with great lanscape and pool. My kids are very happy with slide at pool and the fishing pond. Friendly staff, but need improve the check in process. The hotel provide free andong. Overall is ok, will come again."
"Good part:  Luv the resort! beautiful golf-course, garden, pool and overall outdoor layouts.  Breakfast/brunch amazing Indonesian food   Place for improvement: the room layout could be little better and seemed outdated perhaps may be it adopted ethnic style    overall ...if i am visiting Jogja ---i am definitely coming to this resort!"
"The hotel is very nice. Set among quite, secluded grounds. They have a large swimming pool. The only downside of this hotel was that it was some distance away from city center. They run a shuttle bus from the hotel to city center every 2 hours. But with the Yogja traffic being a nightmare, getting to/from the sights of the city took a long time."
"It was our first time to Yogyakarta and we stayed at the executive suite room (we were upgraded from suite room as the hotel was fully booked). It was fantastic.   The staff were very professional and friendly. The room and the whole property are very well maintained. We feel so peaceful just by staying at the hotel. On Saturday evening, there was a local food fair and we love the lay-out a lot (with many little stalls in the garden). The food is super yummy. We love the nasi goreng (fried rice) so much. Overall the food standard is excellent. The local food maintains the original flavor (and trying to make it subtle to fit foreigners&#39; palate).  The hotel is very convenient to Malioboro street (which is the famous shopping street). But when we were going to Prambanan, the</span><span>&hellip;"
"Rooms are HORRIBLY outdated. The lack of maintenance on the property/grounds and facilities are painfully obvious. Because they all try to save money on A/C by using it ONLY when absolutely necessary, there was often a lingering mildew smell throughout the resort.  Don&#39;t get me started on the Jacuzzi in the &#39;SPA&#39;. It looked more like a petridish for a HS science project. The staff was mostly charming as is the case in Indonesia. The food was mediocre at best, but a horrible value for money all things considered."
"I came here for business but it would have been better for a holiday as all I wanted to do was enjoy the pool and the golf course. None the less, doing business and having a conference here is good. The facilities are nice and they look after you very well with regards to catering.   Will come back with the family to make the most of the waterside."
"The Hotel Is very nice and quite with the ambience of golf course, the staff is very charm and helpful, the pool is big and the ambience is very good, they have slides, and basketball ring,,the spa is good too  I will Be back here soon if I go to Yogyakarta"
"Paradise for family with kids (5-12 years) you can do or organize almost everything with them : kids program can be tailored to suit the needs. Pool is big, clean and nice to spend the day or late afternoon. Long jogging track is a plus also the fitness center quite complete"
"Delightful and all too brief a visit to Yogyakarta Hyatt Regency.  Magnificent expansive property, forcing a tranquility and allowing you to forget you were in the middle of a seriously busy city.  Staff were attentive and helpful."
"Sorry, I only decided to review this hotel almost 10 yrs later but it&#39;s a good thing.This hotel had been on my mind. I love the pool and the slide in the pool. Cools me down for the hot Yogyakarta weather."
"The place is very comfortable for family holiday, the staff is friendly, The facilities and playground very fun for children, The food is delicious and complete, The surrounding hotel is comfortable because have many trees and the air is fresh and cool"
"Its nice hotel for family trip with kids. Quite delicious breakfast and nice pool bar. But need some renovations for its furniture in guest room because there&#39;re too much stain, crack, etc on desk, chair."
"We stayed with them for 4 days and it was a great experience starting from the welcome (jasmine garland ) to an grand entry they have overlooking golf course. The check-in was breeze and we were  pleasantly surprised to see they upgraded one level up and since we were celebrating our anniversary they did send a framed picture of us...  The staff at the front desk and the manager was great.  We did our morning run, use the slides (my kids never wanted to come back), they have a very decent sauna at the back. Kids also tried their hand in fishing :)  The breakfast is a large spread and we did eat couple of our meals at the restaurant and it&#39;s priced good.   We had access to club lounge and to my surprise it was fairly loaded. Drinks, hot food, sandwiches etc...  The location is</span><span>&hellip;"
"We had high expectations for this hotel, since some reviewers indicated it was really worthy of its number of stars. We were HIGHLY disappointed right from the start.  Check-in: extremely inefficient. We were not offered the welcome dfrink that others were getting. My child was fussy, yet the young lady kept talking to me and asking me for my credit acrd instead of asking my husband who was not handling the children. I told her to deal with him, but she ignored that.  We arrive in the room, the extra bed is missing. The lady says it is 50 USD (?) extra per night. What??? The extra person was on the reservation. We have to go back down to the reception and discuss to get things resolved. In the mean time, our luggage is not in the room. We wait, we wait... (we had a tour</span><span>&hellip;"
"Stayed for 3 nights amid a long and crowded weekend in jogja.  A trip with my wife and 2 years old son, we get an upgrade to their junior suite at our second night here. The room was well equipped and in prime condition.. I really like the balcony overlooking mount Merapi, happened to enjoy a misty morning with a cup of coffee there.  One downside that I found during the stay was dining in the room, apparently they did not put the menu inside suite (as usual in other hotels I experienced), they serve the dining menu via web browser. I tried just that, but unfortunately it just did not work for us. But worry not, just a simple phone dial solved it, albeit not knowing the menu.  Overall it was a pleasant stay."
"this hotel have a golf resort, so it&#39;s super greeny and fresh....perfect to take your children strolling around...  the pool was very entertaining especially for children, facilities in this area were complete, the only thing they need to add is LAMP....it&#39;s too dark around....  Food in Restaurant was okay, the variety was quite large with great personal services.  I was Staying in executive suit so I have an access to executive lounge to enjoy an afternoon cocktail. Surprisingly they serve MANY kind of food and beverages including liquor and fresh juice. Nice experience....  Unfortunately, they don&#39;t provide rug in a room and the size of room is quite small. Luckily they have more room than other hotels in Jogja...so i think it&#39;s kinda a thread off...more rooms but smaller</span><span>&hellip;"
"first time stay, check in take long time, needed 20 minutes to enter the room the hotel located not too far from the city, surrounded by greenery, and golf course the facility seems aging, the room clean, internet connection is good very good for family stay, the staffs are friendly"
"overal stay at Hyatt regency feel like at home couse cozy and homy if wanna spending time for drink and cocktail, better book at regency one, have free snack and drink everyday at 17.00 until 19.00 alot of choise for drink..beer, coke and wine..we can drink as we want..and FREE"
The Resort is beautiful.. has a lot facilities and activities. My kids love it. The pool is so big and really entertaining. The foods are great. We can see the beautiful Merapi and surrounded by golf course. Overall is great.. but are you sure your size for King bed is 180x200? 
Not quite 5 star when it comes to food...need to get out to sample other restaurants. Great pool and beautiful grounds. Little spaces tucked away to have drinks or relax. Rooms are quite small especially when you squeeze in an extra bed.
"If you are looking for staycation it is the best place to go to.  They offer great service. Welcome you at the hotel with the Jasmine flower ring!! It smells refreshing.  It is surrounded by greenery but there are plenty of good restaurants and shops nearby.  There are buses arranged to go to Malioborough street (town centre) . Check with hotel staff.   On Saturday/Sunday night, there is a bar near the Golf course and they play great music :)))))  Tips: if you want massage outside of the hotel, call a cab and head to &quot;Kaki Plus&quot; - it is incredibly cheap  and good. Just 10 mins away. It is only SGD7.50 for two hours of foot and shoulder massage. (I tipped the masseur SGD3.00 and I think it made his day ha ha ha)"
Room needs upgrade.  Many equipment are old.  Water from faucet smell and yellowish.  Toilet needs to be replace. Carpet is old and needs to be replaced. Breakfast is excellent and transportation back to airport is very good!
"I had a great stay with you guys. Great selection of breakfast spread with nice pool view. I have also tried the spa on an aromatherapy session, it was absolutely stunning the technic and the attention to detail. I come very often to Jogja and won&#39;t hesitate on making this property my home when there.  Thanks a lot"
"It&#39;s been 8 years i&#39;ve never visit yogyakarta the place that i want to stay in my mind is HYATT REGENCY.. I miss kemangi bistro so much craving for nasi goreng kampung that i ever taste it 8 years ago.. And you know what the taste never change and this is the best Fried rice In TOWN!!!! I still remember ANA the waitress in kemangi bistro and still the same, the way she served me really humble and polite also from the kitchen Mr Ario and Mr. zainal they are still remember me as a CDP really proud of you guys you grown up as a leader in your kitchen, keep them in the company they are Assets in hotel. What a great experience for 1 night stay as really sure i&#39;ll be back soon for stay again in hyatt regency.   Regards,  Gilbert "
"Enjoy the luxury of the hotel with peaceful green scenery representing Yogyakarta&#39;s cultural influence.   Although its a bit far from the city center and malls, but the serene surroundings compensate for the distance. Besides metered taxis and rental cars are easily available and cheap."
We wanted to get away from Singapore for a short break and found Hyatt at Yogyakarta a perfect retreat for relaxing mind and body. The hotel room manager Mr Buddi provided us an upgrade. The room was big and tidy. We were given special treatment because we were vegetarians! Thank you so much for all the staff in the hotel. We felt really looked after.
"Hyatt Regency Yogyakarta is a perfect place to escape from routines. You can trust this hotel for their excellent and high quality services.  Come visit on weekend, where you can dine at night market and watch Ramayana Ballet every Saturday night.  "
"We were here last april for a family reunion. The rooms are nice and the view is spectacular. Hotel is surrounded by large gardens with lots of trees, and there is a path where guests can take a walk/jog in the garden. Breakfast offers a wide selection of food and beverage. The only thing i don&#39;t like is the old style bathroom where the shower is in the bathtub, and the tub can be a bit slippery even though there is an anti-slip bathroom mat provided."
"Very nice hotel, with larger garden area and jogging park, and very beautiful golf field. Hyatt Yogyakarta are really different hotel and fantastic place. Good transportation service from/to central Yogyakarta inner city (Malioboro). Very good employee interaction and helpful. Room clean and service are excellent."
"When I saw the pictures of the beautiful landscape and garden of Hyatt Regency Yogyakarta, I knew it was the perfect hotel for my family vacation in Jogja last month. The lush, green garden made the hotel ambience perfect.  We were greeted with welcome garland from the lovely staff. This is probably the first time I have ever greeted with garland XD we were escorted to the scenic lobby looking over the golf course and with welcome drink in hand. Since we brought our one-year-old son, the staff offer to handle the check-in process so I can just sit back and relax. So impress with the service.  The rooms in Hyatt Regency was actually quite standard and a bit dated. But, the room was very spacious, and equipped with lots of amenities.  Breakfast was great, too bad I only tried few</span><span>&hellip;"
We stayed two nights as part of a private tour. The hotel has beautiful gardens and an attractive pool area. Lots of seating areas and paths to walk around next to the golf course. We were disappointed that it rained during our stay so couldn&#39;t use these facilities.  The restaurant is large  although it was not very busy during our stay. The food was good and the staff very friendly. Breakfast buffet was adequate. The rooms are a little tired but overall we liked the hotel and it&#39;s quiet location.
"have a great stay at Hyatt Regency Yogya, I will surely comeback to stay here again, the surrounding were great, the landscape were beautiful, all the staff were so polite and caring, the food was good, definitely a great place to have meeting &amp; leisure."
"I found this hotel, is not a new building. But, even so, I feel comfortable here. The view outside the window was green trees and spacious grass field. The food was good, and hotel staff was very helpful. I enjoy my stay here"
"To be clear, this is not a modern hotel with uncomfortable furniture and smug guests. This is on the other hand one of the most majestic and serene places you can find in Yogya. The rooms are clean and well kept, the food is amazing, and the pool(s) are an extraordinary haven of serenity, a real oasis the the bustling city. If you were to remark on the true highlight of the stay, it is undoubtedly the service. Javanese are notorious for their polite and friendly manner, and the crew at the Hyatt will go through every trouble to ensure your stay is brilliant. They clearly are proud of their jobs, their culture, and are always polite and smiling. If you only come to Yogya to stay here throughout (venture out - it is a beautiful city), your visit will have paid off handsomely."
The hotel has great grounds but as much as it was originally a very impressive hotel is appears to left to age ungracefully in that it looks old and needed a good clean.  The food was  disappointing for a 5 star hotel.
Staff are the friendliest and very courteous. they remember your name and greet every time they bump with you. Even the gardeners are very friendly. Check in is very smooth and staff took some time to explain all their amenities and attraction within the Hotel. Room are really spacious and grand enough to be treated like king. The View from room is simply amazing.   Breakfast was so delicious and staff at restaurant also very friendly. The surrounding of this hotel is totally amazing. The View of Mount Merapi at 5.30am will make you speechless. So beautiful and must do in Hyatt Yogyakarta. Take some time to walk around the hotel especially their jogging track. Very well plan and design.   They do have free shuttle to Malioboro street and affordable shuttle service to Airport.</span><span>&hellip;
"rooms tired, needs upgrade. The surrounds are beautiful especially the swimming g pool area. Food is very average, not tasty, definitely not cook with passion, just plain, so disappointing. Breakfast is OK, good choice. Not 5* hotel in my books."
"Probably one of the best properties in Jogjya and a great place to start your exploration of the rich history of the region, from ancient Buddhist and Hindu temples to the stunning Mount Merapi, the most active volcano in Indonesia, the Hyatt is a great property with excellent service that makes you feel very welcome every time you step into the lobby. Rooms are very nice, a bit dated, but very well kept and comfortable. The two things that really make this property stand out are the fantastic staff and the property which has lots of green spaces, a great pool with a water slide, and as I mentioned, stunning views of Merapi!"
"Everything awesome, from service to breakfast. Come here couple times.but i never stay here. Mostly meeting my family or friends. So this is my first personal visit. If you want take the shuttle you need to book earlier, especially from malioboro to the hotel at 9:00 pm.  But the check in and check out seriously taking time about 15-30 minutes. Will be better if it faster.   + Cleanliness (5) + Service (5) + breakfast (5) + Facilities (5) "
"I stayed at the hotel for 2 nights. The staff was friendly and helpful, but the hotel room needed a make-over. The pool was not cleaned and partially not functional. Due to a wedding, we could not eat in the inside main restaurant, but had to eat at Bogey’s Teras restaurant. The staff there was completely clueless and ignorant towards our needs. The menu they offered to us consisted only of unhealthy and greasy finger food, for someone to bring us a menu took 20 minutes and for our drinks we had to wait another 15 minutes. The staff there didn&#39;t seem to care."
"Love everything about the hotel especially the garden, the swimming pool and the service. Even though it is located not in the center heart of Yogya but it is worth it. 😙 They offers so many things to do in the hotel"
"Nice Hotel, And Beautiful Hotel with Golf Course...  I was there with all my friend from many city in Indonesia for the accommodation of our Club Touring.  The Breakfast is Superb, with many delicious choices"
"The title summarizes the hotel.  Two thumbs up for hotel service! All staff were responsive and friendly. We asked for several things during our 3-night stay and they responded quickly.  We stayed in deluxe room. It was dated and small but clean and nice with a balcony.   We ordered fried rice &amp; mixed fruit once via room service. It was delivered nicely as the fruit was beautifully arranged.  The location is a bit far from city center but good if you go north (Borobudur, Merapi, Kaliurang). The hotel provide free shuttle bus to Malioboro street. Taking taxi is easy as they are standby in hotel parking area.  Kids would love to stay in this hotel as they have swimming pool with a slide, kids club and fish pond.  "
"I booked this hotel through Agoda last December and I was able to get a room for $69. Since we planned to bring our helpers with us, I got interconnecting rooms.   The welcome party of the hotel were great. There was also security checks each time you go in the hotel.   We get a lanyard of Sampaguita as a welcome from the hotel plus drinks. The check in was a breeze. The hotel is about 30 minutes from the train station.   Hotel grounds were beautiful! Mini stupas all over with several koi ponds. Their pools are well maintained. They have golf courses and bikes for you to borrow.   Rooms were average sized. It has complete amenities. Bottled water are replenished each time. Welcome fruits are available when we first arrived. There are coffee and tea facilities, bathrobes, iron</span><span>&hellip;"
"I stayed in Hyatt for 5D4N with my family. I was able to book this hotel through Agoda. My expectations were met.   Hotel grounds were nice, ambience is great and the welcoming committee at Hyatt was also good. I did not have any problem with the check in. It was a breeze.   They have a wide variety of choices for breakfast. The only thing that they don&#39;t serve is bacon.   There&#39;s a tour desk inside the hotel, so you can book your Borobudur or Prambanan tour with them. You have to book your Malioboro trip ahead of time - as this is very popular.  The Andong Village tour is a horse ride tour that will let you tour the area around the hotel. Nothing much to see, except for houses, hotels and schools around Hyatt."
"Top of mind for family staycation in Jogja. I stay with my toddler (2yo) and staying in Hyatt especially pool and garden, very good for toddler who actively running. Location also nice, far from noise and the facilities are awesome. Yet nice staffs, but the minus is the room interior is so average."
"very pleasant stay here because it is away from the crowds, and very precise strategic place to spend the holiday weekend with family. staff very friendly and helpful. The hotel also provides a bus to drop / pick us into the city center. children can play on the play ground and swimming pool."
Simply the best hotel in Jogja. Great landscape for outdoors. Hotel ambient is amazing. The food is healthy and tasty. The staff is attentive and helpful and friendly. The kids love the ambient and landscape too.
"Stay for a night in the club room feels not enough for our family... we love the pool... my son and his father love the slide and the waterfalls. there&#39;s kids fishing ponds, outbond area, jogging track, spa, bar and restaurant. The hotel also near to golfing area Lots of tree that makes the ambiance so nice, beautifull and relaxe "
The hotel is a great base for Yogyakarta sightseeing as its close to the airport and Borobudur and you can miss the worst of the traffic. But the service is ropey. Room service takes forever and the mains arrive cold. Pool service is soooooo slow. The running path around the hotel is beautiful but not well signposted and in the rainy season the path is so slippery you can&#39;t run fast. If you use the gym instead it may not be clean. Our rooms were connecting as we requested but between our arrival and having both rooms and our two bags took more than 3 hours and 2 trips to the front desk to find out what the delay was. Not what you want after an inbound flight. 
"This was the  most relaxing, enjoyable stay I&#39;ve had at any Hyatt in a long time. From the moment we arrived we were warmly welcomed and nothing was too much to ask. Our room was very adequate, an extra bed added for our son. Spacious bathroom with all the amenities you&#39;d expect.   The hotel grounds are stunning and lush. The 2km running track was great, as was the 18 hole golf course, which my husband and son used often. The spa had a jucuzzi as well as a sauna, which was complimentary with any treatment.   For a very reasonable upgrade you can enjoy cocktails and nibbles each night. There are several places to eat on the premises and if you are fortunate enough to be there over a weekend there is themed cultural dining, including entertainment. The quality of food and variety</span><span>&hellip;"
"You need to stay at this hotel if you&#39;re looking for excellent facilities especially when travelling with kids. They have kids club and free delman rides, bike rental, great pools &amp; garden. You need to ensure the availability of non smoking room when it is your very basic needs. Bedroom soundproof needs improvement, Breakfast menu has a lot of choice but need variety. Even though the room is outdated, it is very clean.  Excellent hotel staff."
Wide country setting and located near the city center. Hotel provides excellent transportation services to historic sites like Borobudur and Prambanan. Restaurants provides traditional Indonesian and Wester cuisines.
Stayed here for 6 nights with my wife. We had a great time. Found entire staff very friendly and ready to assist. Excellent food. Amazing pools. There is 9 hole golf course. We have no hesitation in recommending this hotel to friends and family. 
"The hotel staff ruined the special weekend I had planned to celebrate my friend&#39;s birthday. The hotel is gorgeous. The rooms are clean and the breakfast is great. But what sets a hotel apart from other hotels is the service.  We were treated HORRIBLY at the Hyatt Regency Yogyakarta. First, when we arrived (after a long day on the road to Borobodur), we were greeted with snobbery despite having a Club room. During a 2 night stay, multiple staff members questioned our legitimacy as guests... pretty much every time we came or went we were rudely asked what we were doing there.   Second, although I had made a booking for 3 people in a room, they surprised me with an extra bed fee that was not on my reservation. I agreed to pay the fee without much fuss though I was disappointed that</span><span>&hellip;"
