"stayed at Regency Club Room for two night. check in process was quick and easy. The Room was spacious and neat. I informed the hotel that it was my honeymoon trip, and the hotel give roses petal at the bed and the bathtub. Nice treat. My wife really like it. The breakfast was great. a lot of options from the buffet. choose to eat at the pool side. the view is great. since i stayed at regency club, every evening the hotel provided Evening Cocktail with varieties of small bites, free flow wine and other alcohol drink. overall it was such a nice honeymoon. "
"Positives Staff accommodating and very pleasant to deal with. Food great with a mix of western and local cuisine, many types of sambal and chefs happy to talk to you which was great. Events at the hotel like a Night Market and Ramayana Ballet well put together. The spa affordable, good Shiatsu massage and therapists accommodating when we needed to move appointments made. Beautiful pool with surprising water slide, grounds of the hotel were magical with great landscaping and truly breathtaking. Extra in room options available such as pillow menu, request for an iron, razors etc. Location great for visits to Borobudur, Prambanan and other major temples.  Constructive feedback It would of been handy to have been told that a packed lunch would be available for collection on site</span><span>&hellip;"
"The hotel is very tranquil and calming. It&#39;s a great place for doing nothing for pleasure. My kid love the fast swimming pool and the water slide, unfortunately the small one was broken. but we still enjoy the experience nevertheless."
"Excellent hotel with lots of cared &amp; friendly staff. So many facilities you can do &amp; there’s beautiful scenery around you. The breakfast buffet is great enough. And the one that I personally like is the hot water is always ON &amp; the water pressure is very strong, so my bath time is very great. You truly can’t go wrong stay in this hotel, this hotel gives me a pleasing experience &amp; they will give it to you too. :)"
We were there for 5 days and the attention is very warm and the attention is excellent. The hotel offers many activities for the family and it has beautiful landscapes. Do not think it twice to stay in this hotel :-)
"Always want to come back to this hotel everytime i visit Yogyakarta. The staff is very kind, helpful, and sincerely give their best effort to accommodate our request. The restaurant, garden, jogging track and hotel surrounding view is beautiful. The food is delicious and the room is nice as well as the bathroom. But i wish the room floor is covered with larger carpet, since it&#39;s quite cold in the morning to walk barefoot inside the room. Better and thoroughly maintenance would be required since this is quite old building"
Hyatt is one of the best hotel that myself and my family visited. compare with the other 5 star hotel around in Indonesia.  this is my second visited there. and we still love everything there. even my kids love to stay there.
My family and I was there for two nights. Good and present experience overall from checking in to departure. Even though we didn’t spend must time in the premise because were always our sight seeing but whenever we were back there were always nice service and welcoming atmosphere.
"Nice hotel, cleaned room, tasty food and beverage, scattered and full of choices breakfast menu, big pool with sliding, very friendly staf. Very recommended for family trip. Spacious room. My kid very love the nasi goreng! ❤"
Hyatt Regency Yogyakarta is the best place to stay with your family and I will come back to stay at Hyatt Yogyakarta. The place is very big and really like the feeling of the green and koi fish. I hope they can start to renew their president suite because it was too old.
"I just wanna say thank you with hyatt. Services, facility, all is perfect. When i visited jogja and stay in this hotel completely wonderful.  I felt i chose all in the right way.  I will be back with family and feel again the atmosphere jogjakarta from this hotel.  Perfect!"
"The staff are very nice &amp; helpfull, the hotel room is not very modern but overall was nice. Suggested the hotel to separate floors with smoking &amp; non-smoking area, not really healthy for the baby along the hallway with all smoking free signs. Check-in/out ruless really strict, need to be more flexible for guests with baby"
"4 days spent on this amazing hotel, we are very excited. The people is cheerful and kind. We love the food both Indonesian and Western. Sport facility i.e swimming pool, gym are clean and suitable for us. The one that we&#39;ve never forgot was me and my wife both love Nasi Merah (Brown Rice), and you know this hotel is served this kind of rare thing for us. Thanks you Hyatt I&#39;ll be back."
I stayed at this hotel for around 4-5 days.   Quite surprised how comfortable my kids got here. I think the slide at pool did a good job.  Food is nice and staff definitely is pleasant and helpful.  Place is quite. View is nice. Balcony is an added advantage. Ask for view to the volcano. It really looks splendid.  Left my phone in a taxi and the staff was quick to call the company and sort the issue. Go it back in less than 15 mins.  Recommend this .. always.
"This is my second time to this hotel and again had a great stay with fantastic helpful staff.  As I said in my previous review the downside is that the hotel is a little tired, but I am assured that there is possibility of an upgrade in the future.  Big shout and thank you to Nur  the hotel manager for a wonderful stay."
We are staying here for 5 nights and today is our first day. The staff is very friendly and the hotel is very very nice but today hotel guests cannot sit outside because of an event. People from outside book the whole terrace. This is frustrating. I&#39;m here for vacations and not to sit inside like st home. 
"My husband and I went to Yogyakarta for a short weekend gateaway to celebrate 5-year-wedding anniversary. We chose Hyatt because we got married at Grand Hyatt in Singapore. The stay turned out to be perfect. The staff decorated our club king room with happy anniversary flags in the window and a bouquet of roses! It was very thoughtful of them. All the staffs were truly wonderful, warm and offered so much useful information on Yogyakarta!"
"Was here for a wedding and we spent most of our time in the hotel. From massages at the spa, drinks by the pool to delicious local food at the hotel restaurant, we had a great time all round. Good for families "
"Come to this hotel feels like my 2nd home, very awesome ambiance and view.  Balcony room especially, view of mount merapi , garden and golf field. Breakfast always the best, all attendants at Kemangi and Chef Sugeng, know what my favourite, starting with lemon and honey, bacon, lava egg, gudeg, assorted traditional food, fresh juice, fresh fruits and double espresso. Front desk staff very kind, Fitri. Only need refurbish at room, but still ok because of the view and best service... "
"We thoroughly enjoyed a week&#39;s stay with 2 connecting Club rooms (for my family of 4 incl. 6 y.o. son &amp; 18m daughter + maid). Clean, comfortable and rustic with views over the pool &amp; lush vegetation.   Booking connecting Club rooms was very convenient and enabled us to enjoy inclusive breakfast and cocktails (excellent dishes for kids too!). First time I&#39;ve had a chicken caesar salad made to order which was superb. Each night local delicacies freshly prepared were beautifully presented.  Delightful grounds, kids club, welcome BBQ and other events throughout the week made this a very relaxing stay. And of course the pool and its extensive slide was a big hit for my son who learnt to finish (thanks Henry of the Kids Club!).  Lastly complementary minibus to Malioboro shopping</span><span>&hellip;"
"This was our first time in a Hyatt and we definitely want to come back! It is an absolutely beautiful and big hotel. I love the restaurant, and swimming pool. even it has slide! definetely recommended for family trip. athere is free jacuzzi pool as well."
"I stayed there with my mom right after ied mubarak this year. As the city become way over crowed with tourist, we decide to spend more time in hotel. This hotel is just perfect for any occasion. As for my mom, its lovely to walking around following path along the golf next to hotel. And myself just couldn&#39;t help to not falling in love with their pool! Breakfast was huge and great, i love every food there, and also their cappuchino. Oh i couldn&#39;t wait to back and enjoy this beutifull resort again."
"This was our first time in a Hyatt and we definitely want to come back! It is an absolutely beautiful and big hotel, located a bit far away from busy Yogyakarta downtown but they do offer a free shuttle to Malioboro departing every hour or so. We didn&#39;t feel the need to go outside of the hotel as we used these few days to relax and you basically have all you need inside the resort. There is a variety of good food for modest prices, the pools are stunning and we had so much fun at the waterslide. The staff is very friendly and helpful, the rooms have an average size and look like they haven&#39;t been refreshed for quite a while, however, ours was always very clean and put together. I couldn&#39;t recommend this more!"
"The staff are nice, the room is spacious, they provide you the variety of Indonesian, Chinese and western Breakfast &amp; the pool was amazingly big! Everything went ok,  Except I was disturbed in the early morning by a loud speaker / event held outside (before 6 a.m). Kinda hoping for a peaceful morning."
"The hotel is nicely situated in a calm and green area with great views. When we arrived a company had rented the premises for some celebration which meant a lot of loud music till late night and crowded restaurants. The rooms were quite small compared to others we stayed in at the same price and looked like they hadn&#39;t been renovated for quite some time, still they were clean and kept in good order. Breakfast was good, the kids really liked the huge pool with waterslide. Its a good destination when you want to visit Borobudur and Prambanan."
Good cleaning of part their room hotel. Good interactive guess between. Enough far away from crowded and traffic of Yogyakarta’s downtown. Good food and beverage with many selection. Good price than other hotel at a same location. 
"Everything good but I suggestion to hotel for check condition of chair and sofa in room every day or week (Reference - Cushion is abnormal condition)  Also, Please check ventilation system in smoking floor."
"The hotel and especially the grounds are beautiful. They have 3 pools, and a lot of small seating areas so it feels very private. We had breakfast every morning which is great, so much choice in asian and european food, fresh fruit, an egg and waffle station and even the possibility to have your own smoothie made. The rooms were nice, perfect size and the bed was good. Bathroom could do with some updating. We used the free shuttle to the city center every day. It rins every other hour from 9-9 but has to be reserved in advance and only seats 10 (was never an issue)."
"My friend and I had an amazing stay - staff were very welcoming and kind despite our often odd requests, catering was delicious and the cooking class was great, and we enjoyed our cycle tour (but would recommend wearing helmets, the road is pretty bumpy). Thanks so much for a great stay!"
"I didn&#39;t actually stay at the Hyatt as all rooms were booked however they did but me in touch with their tour desk Angsa Tours and even though I was staying elsewhere they Organised my Borobudur Tour. The day was excellent, our tour guide Yun was excellent and so informative. The only disappointment was they seemed to take the Long way back through the villages which meant we went over time and was charged and extra hour, very disappointing as it was not our choice to go that way.  Based on the great information Yun gave us we decided to do the Prambanan Temple the following day. They were able to accommodate us the following day and we paid in advance. I cannot believe they charged us the same price for Borobudur and Prambanan, which is much closer. Our guide, I do not know his</span><span>&hellip;"
"I stayed at the Hyatt Regency Yogyakarta for 3 nights. I have a mixed review here, though overall any complaints will probably just be nitpicking.   To start, the property is spectacular and stunning. Every detail is amazing. The golf course is beautiful, the pool is beautiful and the facilities are beautiful. No complaints on the outside.   Let’s go to the room. Mine was of adequate size. I didn’t have much of a view, but I also had their standard room. The shower, to me, was a bit small. I am about 6’1”, 230 lbs, and I felt really cramped in the shower. That would be my only complaint.   The staff. Excellent. Attentive. Friendly. Zero complaints.   Fitness center. Well…. Really no such thing. They have a “gym” that is actually the size of my room itself. There is a couple of</span><span>&hellip;"
"We booked a room with a king bed that was actually a queen size bed.  We called the front desk and they said it was a king bed. A few doors down was a suite with an actual king bed in it and housekeeping admitted to me that there was definitely a difference in size between the two. I&#39;m really having trouble figuring out why this is considreded ok, because I feel like I was lied to.  Also, if you book a massage in the spa, be sure to book during the day. I booked mine at about 5:30 or 6PM and 10 mins after it started there was loud electronic music litteraky BLASTING from a cafe next door to the hotel which made it impossible to fully relax."
My experience staying at the outdoor part of the restaurant for breakfast and and dinner were great and unforgettable. The trees covering the restaurant makes the outdoor part of the restaurant look and feel natural and cool. The newly added  glass roof ensures that guests will not get wet when it&#39;s raining and thus do not need to leave the premise.
"Very attractive hotel and environment. Lovely gardens and spacious, well-equipped comfortable rooms, consistent with the better Hyatt Regency hotels elsewhere. Great buffet breakfasts with excellent local and international cuisine. Great service. Very pleasant clubroom but limited dining. Great multiple cascading swimming pools."
"Having originally from Yogya, I always stays in Hyatt Regency Yogyakarta every time I came with my partner to visit my family in Yogyakarta. This time we came with my in laws as well. Hyatt gone extra miles to make sure our stays amazing. My in laws were so happy with the service and so was I. I always felt home in this place. The swimming pools and the gardens are exquisite and well groomed. The breakfast buffet was the best I&#39;ve ever had! "
"Perfect hotel for your staycation, the beautiful view makes us very comfortable and relax. I am in love with the ambiance and pool. I think your room is time to be renovated to be more awesome. Good luck Hyatt"
"In the world of Hyatt, Hyatt regency Yogyakarta is unique. The pyramid architecture of the hotel building has no second one. The location is at the suburb of the city. Taxi can be easily hired anytime at its parking lots, if customers want to visit Malioboro boulevard. The green plantation is well cultivated along the multi-levels pools, golf courts, and main building. In a walking distance, some convenient stores can be found along the streets, not very isolated. It is an old hotels with good maintenance for years. Some facilities have worn out but acceptable with own styles. The elevators seem to be an antique but still work. The room rates are correctly aiming for luxury markets and competitive in town. It is therefore popular with meetings and events, couples, family, golf</span><span>&hellip;"
"Food, service and accommodation was excellent. Very friendly staff and prompt in their service. Has great facilities indoors where kids can really enjoy the pool and treehouse, a track to run, to walk, a restaurant and a club with reasonable prices, a spacious terrace outside the hotel lobby, a large beautiful, neat and tidy landscaped garden with cultural artefacts and a convenience store in the hotel so very proximate. Easy access to Malls too by cab which can be hailed by the hotel at no extra cost. "
"Recommended hotel for business and family vacation. The location is not far from downtown. Clean and quiet place, perfect for refreshing. The taste of food is very good. The staffs are so nice and friendly. 4 thumbs !!!!!"
"Great 5 star hotel with garden view and scenic golf course. Rooms are standard, but I love the balcony as it has garden/golf course views. My parents stayed in president suite room, which is very spacious. The service is excellent, staff are very helpful and friendly. Swimming pool is great, and they have gym too. The whirlpool is not great because the water temperature is the same as the swimming pool. The breakfast buffet is great, great variety. The only thing is that the waiting time for omelette is as they only have one chef making the omelette. Overall, really enjoyed my stay in this hotel."
"Simply perfect hotel. Top notch in every element, and for a very reasonable price. It&#39;s just outside the most busy areas of Yogya situated in beautiful grounds. It has everything you need: a big pool, good spa, sports facilities, tour agency in the lobby. The breakfast was good, as were the lunch options and the special bar for late afternoon drinks. They had a buffet with different theme every evening, which was - unlike the average hotel buffet - pretty good. One evening they even had a full-fledged Ramayana Ballet performance, including live musicians and a dozen actors. Most importantly, the staff was very friendly and experienced, and really made you feel at home."
On a golf tour of java we stayed at the hyatt and enjoyed a round of 9 holes on the very scenic golf course. Stayed in hyatt club rooms and the service and standard were excellent. Great beds very comfortable club lounge and a breakfast that will increase your waistline. The pool and gardens are sublime.
"Everything was perfect. Big 10 to Hyatt Regency Yogyakarta. All staff member, including their manager, executives were treated guest like family.  Great view from all guest room windows (graden, swimming pool, golf course).  Kemangi Bistro restaurant which located outdoor faving to swimming pool are excellent, many great food selection. They’ll make you stay from breakfast till lunch. Dinner was romantic within Kemangi"
"I stayed here in July/August 2017, and it remains one of the best hotels in customer service. The hotel and grounds are really spectacular (and do explore them if you stay here). A lot of those staying here do spend a lot of time around the pool (which isn&#39;t my thing, but it looked quite small for the amount of people in it). Buffet breakfast is excellent with a broad range of Asian and European. Dinner can also be spent here as the hotel is quite far from other restaurants. Food is fresh and quality is good (I ate here during my whole stay). Spa and hair treatments are also reasonably priced if you want to take advantage of those too. Rooms are spacious and clean, although somewhat outdated (bathrooms was particularly tatty) which is a real shame given the rest of the hotel is</span><span>&hellip;"
A nice experience of stay at Hyatt Regency Jogjakarta  Nice staff and managerial hotel. Variety of breakfast at Kemanggi Bistro. Spacious garden and golf view with ambience of Central Java   Need more rennovation especially room and bathroom  
"This hotel is a oasis in Jogyagarta. The gardens are beautiful and  reflect the culture and the temples near the city.  Food and spa service are so cheap, the only problema are the alcoholic drinks, the are very expensive compare to everything."
"This is a stunning hotel, beautifully decorated inside and out. It has great character, reflecting the city of Yogyakarta. The hotel staff were friendly and helpful and the food was very good. The hotel also put on great entertainment at weekends (we watched a traditional Indonesian Ramayana dance). Would definitely recommend to anyone visiting Yogyakarta. "
"We just returned from a blissful holiday in Hyatt Regency , Yogyakarta and couldn&#39;t rave more about the excellent service and hospitality . From the moment we arrived, the staff went beyond to ensure our stay was comfortable. The checkin was a breeze and the complimentary shoulder massage was a welcome treat . We were traveling as a family and throughout our stay, our 3 year old son was pampered by the staff who always greeted him by his name :) The resort itself was expansive and there were many activities to keep our toddler busy.. he enjoyed feeding the koi fishes, cycling around the golf course on the hotel&#39;s complimentary bikes, swimming in one of their many pools and even fishing in the pond (and releasing them back into the water) . Overall, it was a wonderful and</span><span>&hellip;"
"We stayed here for two nights.  We stayed in a non smoking room and had breakfast included.  The highlight for us was the waterslide at the swimming pool, and the friendly staff at the hotel, and our fantastic driver, who went above and beyond.  To top this off, we had some great food to eat."
"The hotel is great, but the rooms were noisy and in need of updating. Taps leaked, no milk for coffee and the linen was stained. Disappointing as this was my honeymoon. The staff were friendly and attentive, sometimes too attentive. When I revisit Yogja I will stay somewhere else."
The Hyatt Regency in Yogyakarta is a luxury hotel close to the heart of the city.  It is quite an old place now and is a disappointing place to stay without the charm it may once have had.  Getting to the Hyatt Regency is not too difficult with an airport transfer.  It takes about 20 minutes.  Being well located the centre of town is not far away.  Check-in was fairly simple even through a travel agent booking.  Check-out was quick and efficient.  Service was friendly even if a return airport transfer had to be clarified a couple of times.  Confident English was spoken.  The room was ok.  Given this is a luxury hotel designed with the local Yogya aesthetic in mind it was nothing special.  The room was not especially large and was more functional than anything.  The design was</span><span>&hellip;
"As you leave Yogyakarta&#39;s airport and see the busy and stressed city (as an european) you don&#39;t expect to find such a place as Hyatt. Very quiet, peaceful, modern and very pleasant. The staff is the most friendly you can imagine and the hotel offers all the facilities one requires to relax and spend a good time. The favt that this hotel is nearby the city (although you don&#39;t notice it) is great because it gets you easily to the main city&#39;s attractions (which is the main purpose of tourists going there). "
"I , my family and friends stayed one night in August 2017.  We expected to have 5 stars luxury and comfortable room but the hotel&#39;s building is very old especially the bedroom. It&#39;s not worth for money I spent."
"If you want to have something elegant, patient and safety this is a good choice. Many pools, gym (!), nice garden, tasty and variable food in the restaurant, helpful staff. We enjoyed our 4 nights here. Good choice for a good price."
"First time I see this hotel, My doughter is in love with their pool. They have a great pool. And if you stay in Saturday, they will have Ramayana Ballet in their courtyard, you will love it. This hotel is very recomended."
the water knob in the bath tube is old and made my hand injured when i tried to turn it on for fill the tube with water. I also noticed that the taste of the food is not ok. the range of choice is not too much.
"We came here for our honeymoon. The location is sensational ! And the welcome was great. They gave us flowers necklace, and took a picture for us. In the room, there were rose petals all over the bed and in the bath. Was great. After our day, the picture was printed and on our desk with nice words from the crew. However, the prices are incredibly insane, come on 25 € for a 3 kg laundry ? That was really not good, and the bad point of the stay."
i am glad i choose Hyatt Regency Yogjakarta for my 1st trip to this city. it was a wonderful stay for us (family) and we appreciate all the staff efforts in making our 6 days stay memorable. TERIMA KASIH ..
"Hyatt Regency is great hotel and cozy place. The food is excellent , the staff is friendly and the room is clean. Have a great pool ( many pools), have a big and great garden. Nice place for kids to play around and have beautiful view for photo spot"
this is very good hotel with very nice staffs. the gardens are maintained very well. some activities offered are interesting. a bit far from down town but it has shutlle bus service for all guests. the food served are really good and vary. some nice restaurants are available near the hotel.
I really enjoyed my time at this property. It was so nice I almost regretted leaving to visit the town and temples. The breakfast spread is expansive and tasty. The large pool was always a pleasant reprieve from the midday heat. And the price is quite reasonable. I think this is my favorite Hyatt property after the Park Hyatts in Zanzibar and Vienna. High praise.
"We check in late 5pm and check out 2pm, the staff very helpful plus we get discount for breakfast and upgraded room attached with balcony. Hotel facilities very awesome. High security. Love it. Will stay again. "
