"Hotel with proper hygiene to protect against COVID-19 Staff and trainee are friendly. Great taste of breakfast and very delicious rice bowl. Bed is comfortable and comfy. - Services from the team members are excellent, especially at the restaurant. Pool and angkringan are very joyful."
"We went (the whole family) for a vacation in Yogyakarta. There are many hotels to choose. Decided to stay in Hyatt Regency because of the location initially, but experiences that we got are more than what we expected, especially the facilities."
"When i decided to stay here, I know its interior is dated, need renovation. But I still like to stay here in the future, because this hotel has very good staff, and has one of the best outdoor facility in this city. "
"Good view and very nice swimming pool area, you can walk at the jogging track and enjoy the cool air among the trees,   Good traditional food like getuk, nice staff and good service,   You can found your peace at Hyatt Jogja.  Will be back again when visit jogja   See you soon"
"This hotel is very nice, especially its outdoor facilities like jogging track, bike rental and swimming pool. We can enjoy a beautiful views of a well managed garden and golf course with Merapi Mountain as a background. "
"the best service, hotel staff was very nice, escorted from the front desk to the door of the room, detailed explanation of the facilities, comfort and cleanliness that are guaranteed during a pandemic"
"the service at hyatt regency is very good, the hotel is also good, especially the large swimming pool and its golf court. I offered to upgrade to a club house and get a good complimentary. Quite worthed for those who like to enjoy cocktails in the afternoon. Overall the service at this hotel is very good especially the restaurant."
"The experience of staying at the Hotel Hyatt Jogja will be a pleasant moment. The atmosphere is comfortable and close to the city of Yogyakarta. Large green space, golf course, swimming pool, and more. I love cycling in the morning around the green route. Get the fresh air and oxygen and the lush green views."
"We had a wonderful stay in Hyatt Yogyakarta as we made 2 days in a beautiful surroundings including golf view , beautiful and huge pool , tennis court and grab wheel. My kids enjoyed all  those facilities and their favorite have been the tarzan rope at the pool. We will be back"
"Rooms are getting dated, but facilities were great. Guest recovery service was not good as I did not receive anything except apology for the keycard being programmed wrongly twice. Besides front desk, other department services were great!"
"So many activities for kids on vacation, it’s very interesting; bicycle riding, mini golf, swimming pool, and hot stone lobster is good. The room hotel a little bit old, but the maintenance is good. thanks for your hospitality."
"i stay in this hotel when i visit yogya. the reason is my daughter love the swimming pool. the swimming pool is large and have a long slide. the balcony have a nice view, you can also ride a bicyle and scooter at the jogging track "
Big  outdoor area with various family activities  perfect for bringing family in new normal era. The children love the pool and games activity and rental schooter. There also bike for free to be used for 3 hours.
"I have no complaint to the hotel’s facilities. It is surrounded by a huge green garden and they offer some activities. Restaurants have good food (only tried bogeys and kemangi), staff are very helpful and responsive, room ammenities are complete.   My 3 stars ratings is due to the very old condition of the room. It needs major upgrade. Room phone is broken, TV remote is broken as well... sofa has seen a better days, bed is still okay but the 2 out of 4 pillows are lumpy, furnitures are worn... Mind you I stayed only at deluxe room, so maybe in higher room classes the condition is better..."
Very clean over all satysfy thx u 🙏 Very kindly all staff make me and family happy .... very helpful mybe next i request have to choice type of room not just available thankyouu  Breakfast have many menu of local food
"When checking in I was told that my room was upgraded especially because I was a guest who had several experiences staying at the Hyatt Jogja. The hotel distributed free hand sanitizers and masks to guests. The staff are very friendly and helpful. Room installed sanitary stickers. The food and drinks at breakfast are quite varied, the food and drinks that I ordered in the room also tasted ok. The facilities are very complete with a wide landscape and great view (golf course, playground, grab wheel, swimming pool, etc), suitable for family vacation with children. In generally I’m satisfied stay at the Hyatt. "
"All the staffs is very kind and friedly. They always smile and helpful.  But the check in process took a long time. It was more than 15 minutes. Then, we had to wait 20 minutes more because the room would not ready until 15.00."
"Overall meet expectation,, althought in pandemic moment we can still have actitfities in public area without worry because Hyatt runs the covid protocol. For example for breakfast time, no selfservice but servered."
"Overall service, cleanliness, room, etc is very good. but i’ve a bad experience with the housekeeping staff. after the room was cleaned was not given new slippers for my room.  by the time i asked for new slippers, i had to wait almost an hour"
"Definitely back again soon, everything is good. This hotel is very family friendly with large pool and large garden. The room is very clean and the amenities are complete, they even provide ironing board in each room. "
"It has a good health protocol during this covid 19 pandemic. It makes me feel safe during stay here. It&#39;s nice to spending my time with my family here.It&#39;s clean, tidy and friendly staff.It&#39;s recommended :) Thank you"
"The room is too old. The swimming pool is slippery (need to be cleaned), the gym and sauna are too old (looks dirty). The hotel hosts 2 weddings and dog show during my stay. I would appreciate if they warn the guests that they would host such big events during covid period."
"The staff is friendly and helpfull, i really love the view, the bathroom.  I enjoy my stay here. While me and my sisters are having bridal shower in the room, it was fun. We ask a lot of help through the telephone to Receptionist, and they answer very well"
"Great Hotel with very nice environment, we can view of mount Merapi from the lobby. Service was excellent and ease of check in and check out, food was good and many activities that we can join including cycling in the morning"
"The staffs, the room, the ambience, the foods, everything was great. Hyatt gives me the best stay experience during this crazy time. I really enjoy the stay. Certainly will come back to stay at Hyatt Regency when I come to Jogja."
"The hotel just the same like picture. Breathtaking view on the landscape. Hotel looks old but still very well maintained. Everything was function perfectly. Bed and pillow was very comfortable, even the extra bed too! We had a good sleep there and really enjoyed the facilities especially the swimming pool. Staffs are very nice, breakfast are delicious eventhough we were quite surprise that the varieties were not as much as regular buffet but we can understand that maybe during this covid time they try to manage simple breakfast but still with health protocols way. But there was one thing is quite dissapointed that we found a glass in our room was still dirty. The coffee stain still there. But overall it was a great experience staying there and will go back for sure. For those</span><span>&hellip;"
"Beautiful view completed with golf course, perfect for honeymoon, and the staffs really care your needs. Especially a trainee named Reza, he helped me a lot. Also, the staff gave us beautiful flowers arrangments and a surprise gift when I checked out."
"Excellent services, very clean room and also already complied with the health protocol (with respect to the covid 19 protocol). We absolutely enjoy. We also like the location of this hotel. Overall excellent."
"3 stars is a little generous and it was the amazing staff, nice pool, and decent food that saved the review for this hotel. The rooms are very outdated and somewhat musty. I asked the staff and they said it had been 20 years since they have been renovated and it shows. The only thing worse than the rooms is the fitness center. Really just a small room with dingy carpet, two older treadmills and a few outdated weights. "
"We were staying at this hotel with my 2 daughters, and took 2 rooms at regency club. Unfortunately, the hot water was not good, seems need to be improved. The bed is need to be changed (quiet old I guess), and bed linen as well. We were enjoying the breakfast, overall the menu was good. "
"A great big hotel in the middle of the city. The condition of the hotel quite old, but in good maintenance care. Our family experiencing a good staycation in a good environment, a big green environment around the hotel"
"I came here for my intimate wedding party, stay here for 2 night with family. They love their rooms, and the foodis delicious. Everyone are kind and helpful, i would love to come here for another occasion. Thankyou!"
"I didn&#39;t expect too much before, but facilities at Hyatt Regency are very sastifying us, i hope can stay at Hyatt again soon. I enjoyed swimming at the pool, riding bicycle, and also i enjoyed the Vibes and the room"
"Very good experience of &quot;staycation&quot;. During this pandemic era, the hospitality and overall services maintained a best quality approach. Warm welcome, kids and family friendly. A lot of laughter and happiness. Many thanks, Hyatt Regency Yogya. We&#39;ll be back.. "
"Perfect choice for those who want to enjoy stay in beautiful hotel with nature surrounding. I enjoyed my 3 nights stay with whole family, babies and kid. The staffs were very friendly and helpful accomodate our needs. Swimming pools were awesome. I will definitely come back."
"Almost 3 weeks 13 Oct - 28 Oct I have been stayed in Hyatt Regency. The most i love in this Hotel is the food. Set menu is surprising me, Indonesian taste, I love it. For Hotel facilities, there is Golf Course, Swimming Pool, Jogging Track, Gym, Bike, and mini Bar."
"Actually, this is not my first time staying here. and it&#39;s satisfying as always. nice and helpful staff. beautiful view. it&#39;s an old building hotel but the service is gold. so it&#39;s worth to stay here for vacation. thank you "
The hotel is family friendly and have a peaceful athmosphere. The pools are best. Choose the outdoor area to have your breakfast and you&#39;ll have a sensation having breakfast under the trees and poolside. However they only provide very limited menu variance for breakfast. We had the same menu when we stayed for 4 days! We also found that the closet in our room was clogged and we also need to ask for a doormat in the bathroom as they provide it only on the first day of our stay.
"The hotel facilities are really excellent. The food offer is convenient and appropriate for western travellers wanting to have variations beyond delicious Indonesia Food. There is a 9 hole golf course surrounding the hotel. The pool is absolutely beautiful, with many nice corners, that provides you alternatives for sun or shade, being grouped with friends, or isolated."
Its very nice to make happy my moms in the beautiful place for taking rest and having fun at yogya...swimming and relaxing in hot pool...its became good memory for our quality time with my moms and my sisters
"I love the room, good breakfast, have a nice facilities, great views. the staff are friendly &amp; warm. Unfortunately due to low occupancy during the pandemic, they limit the hot water for shower, I understand they have to do it to safe their opex "
"The largest hotel in Yogyakarta with open space. You can do a lot of out door activites, such as golfing, jogging, feeding fish, play with turtles, fishing and lot of more Great experience with strict health protocol to keep us safe. Will come again in the future. :)"
"Ithe hotel has a very large area, include a golf field at the back, the landscape is green full of trees,garden and pools, complete facilities, very suitable for family with kids, business meeting and leisure. I love it and surely will come back again"
"The hotel is close to several decent eateries such as Ikan Bakar Cianjur, nasi uduk palagan and Iga sapi bali.  The hotel is side by side with golf court, despite being nearby Palagan which is rather crowded and bustling, it feels like in a different secluded peaceful region.  Great huge swimming pool, gym available 24hours, fish pond along with many other facilities.   Since our visit is during pandemic, upon entering the premise, temperature scanning (compulsory) and hand-wash/sanitizer available. We were provided with scuba face-mask and pocket sized hand sanitizer upon check-in. The hotel claimed that frequently touched surfaces in hotel premise are sanitized hourly while room seems to be sanitized and sealed at the door prior to check-in.  Hotel building is aged but well</span><span>&hellip;"
"I love the relaxing ambiance, exciting experience as well as the friendly staff. The amenities also became the highlight during our trip as Hyatt already provide everything you need in one magic box!  Even though the room interior still feels classy and old, it did not affect our sleep quality at all. It is our first time staying in Hyatt and we would love to come again someday."
"The staff is very friendly and helpful. Best place to staycation. This hotel have big swimming pooln. The garden is so big. The ambience was good. The facilities like jogging track, bicycle, golf, and more is pretty good to try"
"Wonderful experienced wth my family, also my son really loved the pool so next vacation i really put this hotel to my priority plan... If u want to taste the food i suggest banana flitter and nasi goreng kampoeng.."
"I really enjoy my stay at this 22 hectare hotel. Their hospitality was very impressive. All the staff are very friendly and helpful. Breakfast served with various quality items. If you got bored, you can request simple dishes as Wonton Soup, Fried Noodle etc. My room package were included with Rice Bowl for dinner. There&#39;re 6 kinds of rice bowl in the menu for you to choose and all of them are delicious. After 20 years of operation this hotel needs remodeling, indeed. But still everything was still running very well and clean. If you are around this Hotel area, this place is extremely recommended."
I spent my birthday trip this year to do staycation in this hotel. Actually I want to enjoy the Ramayana ballet at the dinner or do afternoon tea but all that facilities was not open due to covid. The best thing was the staff made nasi tumpeng at my birthday and that&#39;s really touching.
"I just want to say .. excellent place . This is not a new building but they can maintenance this resort to keeping good condition with more than 2 hectares land . You will be not enough to stay one night only to explore this resort and feels like whatever you want  to do there . Thats food presentation for breakfast it’s complete and a delicious. Specially you come in a summer session weather of indonesia it’s really recommended. All staff so warm and helpful . There is a lot of activities in a hotel such as bike , fishing and more ... you can also playing golf in this resort . "
A very memorable experience while staying here for a few days  Very Clean Hotel and very friendly Staff And About The Food Everything is ok  Special thanks to Front Office Staff Duhita Lovas  Cant wait to stay again  See u Very soon 
"Obviously our experience at the Hyatt was skewd due to circumstances but  our stay was fabulous nonetheless.  We had planned two weeks in Indonesia (Bali, Sumba, and Yogyakarta).  The last week in &quot;Jogya&quot; at the Hyatt.  What we had not anticipated was  the impact of the pandemic COVID-19.  To our dismay all the parks and museums and in particular the Hindu temple had been closed due to the virus.  Fortunately for us the hotel had not closed although we were one of only a few guests that week.  The wait staff were superb in every way and the intense precautions they took to sanitize everything made us feel very comfortable and safe.  We exercised &quot;social distancing&quot; but still managed to enjoy the lounge, restaurant, spa, and pool.  The hotel even upgraded our room to place us</span><span>&hellip;"
"It was a pleasure to stay here. excellent service from arrival to departure. i would like to say a big thank you for making my birthday stay a huge success and that wouldn&#39;t have been possible without you guys, Popy, Acong and team is very professional,friendly and halpful they are doing great job for their guest, the room was clean quiet and beautiful with all amenities you may need. the bed was &#39;king size&#39; and very comportable for sleep. The beautiful cake when we arrived was great!,the hotel restaurant had a great buffet breakfast, my special thanks to pak Rendi which is explain anything about how good &#39;jamu&#39; is for our helath :),thanky you so much for your hospitality we had a great time and hope to stay longer next time.  good luck guys you all simply Rock!!"
"Love love love everything about this hotel. From the friendly gestures from their staffs to all the services available, I feel like a Javanese royal being in the hotel with its impressive indoor decor and outdoor landscape until... I get in to the room. The decor of the room was slightly.. underwhelming. It was all grand until I get into the room. It was good but not good enough for a grand hotel like Hyatt Regency. But that didnt dampen the experience I had. I made use of all the facilities available such as the jacuzzi, sauna, cold whirlpool, swimming pool, andhong tour around the gold course and the amazing breakfast! And I just knew they also offered the free shuttle to Malioboro which wouldve been useful since I was running out of Rupiahs on my last day in the city.</span><span>&hellip;"
"A great hotel for a group booking if you all want to have a fantastic time. Great ambiance throughout the grounds, from the Koi the size ofsubmarines to the temple that doubles as a slide into the pool. Staff are great, attentive and quick. Breakfast is great, with some amazing dishes - the crusted snapper especially. The series of pools allow space for kids to play and adults to doze.  Downsides are that it is out of the city centre, which with the traffic can take a while to get to, and accidents can happen on the slide as there is no automatic light system for safe to slide. Having a 16 stone man crash into the back of my neck at speed was not part of my holiday!"
"Most amazing and sincere service i&#39;ve ever experienced in a hotel. I&#39;m a local. Indonesian hotels tend to put more special service towards foreigners. BUT NOT THIS HOTEL.  Top notch service right from check in until check out. Facilities were impeccable. The hotel itself were quite old but very well maintained. Free andong (Yogyakarta&#39;s horse carriage) ride around the hotel facilities, free shuttle service to Malioboro, great pool, nice rooftop view,  and many other facilities that you have to experience yourself. Breakfast are awesome and always gets refilled. I need to mention ms Christine who gives us very warm welcome upon check in, and mr Sugeng, one of the chefs. He asked whether the food is nice, and then we chat like we were friends for a long time. Staffs in general</span><span>&hellip;"
"Im staying at Hyatt today for 1 night only (room 523). First impression, Hyatt is the real 5 star hotel. We were served excellent upon check in. Ms. Christine explained us the facilities and help us for check in process. She also suggested us to take picture together. And then she escorted us to the room. Woow excellent service 😍😍 When entering the room, we were really touched of the honeymoon set up we got. Actually i requested it 1 month ago and they noted it well.  i love it so muchh.. they gave us fresh red rose and slice cake and it&#39;s free.. 😍 Then i explored the facilities, i came to the Club lounge and swimming pool. It has 3 swimming pool and i love it. When i took picture at swimming pool, the staff named Adam  greets me and talk with me. He&#39;s friendly guy and i like</span><span>&hellip;"
"We are celebrating our anniversary at Hyatt Regency Yogyakarta and we are very thankful to all staff are friendly, especially for Front Office Team ! It was beyond our expectation. Nothing is better than going home to family and eating good food and relaxing.. thanks a lot !"
"Nice place to staying in town for a long time. I am very excited about the opportunity and the family is very happy. We can swimming, fishing, massage, tables tennis, golf, running, jogging and many more. "
"Worth to stay here in Hyatt Regency. We can enjoy the garden, the pool, and the food is soo tasty and yummy. The staffs are nice and helpful. It was really a memorable experience for me, my baby and my husband. Looking forward to stay there again !"
"Went to Hyatt for a work break and could not have been happier with probably my best 2020 purchase (it&#39;s still early but it&#39;s just that good). The service was top notch, everyone were very friendly and helpful, I though going the extra mile was just a cliche, but it certainly was as real as it gets for Hyatt. The views were sublime, the facilities were plenty, and the food were fantastic.   I could not have found any faults in this hotel aside from maybe kind of an older room design and pretty raggedy bath robe.  I will definitely be coming back."
"This hotel is highly recommended for leisure purpose. Nice, cozy, peaceful for the whole family. For those golfer this hotel also provide their hobby. Bring your children under15 years and they will enjoy."
"Exceptional facilities, good location, very clean, beautiful territory, helpful and nice staff. Nice place to yoga, meditation and massage. Great place to rest with children. Big territory with many facilities. "
"Exceptionnal Location and Services in a Natural green area The best in Yogyakarta all compared on our opinion. Awesome staff, attentive and efficient. High level food and large choice of javanese and international meals and drinks. Great experience"
I return year after year to this venue and am very happy to be returning again this year in March.  This is my favourite hotel and I travel all over the world.  Im bringing 4 colleagues with me this time in March and am so excited.  Staff and quality of hotel second to none.  
"I stay here many times since year 1999 when my son 3 years old and this resort hotel never fails me. Until now my son only want to stay in this hotel whenever we are in Jogjakarta. Everything always very good, i mostly like the pool area, 2,5km jogging track,  amazing breakfast buffet, and rooms overlooking greenery, very comfortable bed, but i mostly love is the staffs, they are all genuinely polite, always greets me by my name and always very attentive specially Anna at breakfast area, and Sugeng at the kitchen, they make a very delicious ‘Nasi Goreng Kecombrang’ cooked ala minute special for me at breakfast."
please consider the late check out request if justified within the allowable hotel rule as  my request for late check out during recent stay in the hotel  is rejected by receptionist with no clear reasons
"I stayed here for my cousin&#39;s wedding. The room was not ready yet when we arrived as we came before the check in time but i did love the welcoming gesture from one of your apprentice who also helped me for the check in.  The exterior is indeed very nice and it reminded me of bali.  After came back from lunch outside, we could go to our room. I saw the lady at the reception were holding my cousin&#39;s wedding booklet but she didnt give to me and only the keys so i thought the book will be for later. The room itself is really simple room with not so much interior. But it was soo noisy. There were project going on both left n right rooms beside mine and on top of mine too! So my room was like being surrounded by the project sound.  You can hear people banging and drilling the wall.</span><span>&hellip;"
Very nice hotel. Friendly staff and workers. Very Delicious food and breakfast. Excellent sport facilities. Located in a strategic area but little traffic.  Enjoyed the stay. Looking forward to stay here again. Recommended hotel.  
"Never been in a better hotel in Yogya than Hyatt Regency. Welcomed by the friendly smiles of all staffs, the check in process was quite. They had been able to accommodate our request for connecting room since we stayed with 4 kids.  Beautiful green lovely garden landscape around the hotel, made us oblivious we were in the middle of busy area in the town. Breakfast was amazing! Had various menu options from western menu to locals!  "
"Everything is awesome,,  i&#39;ve never have this such of service in any hotels,,,  such a pleasure to live in one of this room to have different experience ,, thank u very much for welcoming my family with a warm smile"
It certainly family hotel as the outdoor space is really big and green. Buffet breakfast has lots of choice (add dim sum in  your menu please...). Rooms certainly need to be updated. Staff are very friendly and helpful. Very recommended hotels.
"The people at this beautiful resort make the experience better than you can imagine. Friendly, helpful, and kind. This is an extremely beautiful property with a huge pool and a pretty golf course. A local village Bar-b-q and customary dance is available to attend Saturday nights. "
