"We stayed for 3 nights at this property and we really enjoyed, the hotel grounds are beautiful and the rooms are a bit worn out but still comfortable and clean with nice beds! We had breakfast and lunch at the hotel and everything was really good, from the service to the quality and the price. But the best of this hotel is its staff, everyone is very nice and friendly. They also provide a shuttle to Malioboro street which comes in handy. If your flight is early morning you can request a breakfast box. My friends also tried the spa and loved it! Overall a great property in a great city!"
Very nice hotel with vast amount of greenery and a 9 hole golf course. Close by to a really good &quot;warung pecel&quot; (Indonesian salad). The room is quite big and nice and all  you can expect from a 5 star hotel including the service.
"It was good experience while staying in this hotel.With a charm staff,we were guided to the check in area.Very good ambience sourrounding this hotel.Through the room with a big window we can see the beautiful view.Breakfast is also good with many varieties.You can meet traditional culture of Jogja with a touch of modernization."
"Beautiful hotel with magnificent grounds - the multiple pools, water slide and surrounding gardens are beautifully designed, all in keeping with the ancient ruins &#39;Borobudur&quot; theme. Staff are friendly and helpful and buffet breakfast has great combination of local fare and Western favorites. Free andong rides, excellent massages and Ramayana performances add to the charm of this great hotel. Exceptionally good value for money - would highly recommend Hyatt Regency Yogyakarta."
"It&#39;the second time I chose this jotel during my staying in yogyakarta,and it feels like being in heaven! The room is very clean,with fruit on the table.The service is very professional,I cannot complain at all about the personnel and you definitely have to try indonesian massage (2h one),you will never regret!the sorrounding field is something I have never seen,after a long business trip is the only place I want to be!breakfast has lot of variety.there is also a shuttle which goes to the centre"
"We were there a week ago for three nights , the hotel was very good , clean, and nice location,... The only things is the bathroom without normal shower...?? How can be in a five star hotel? And restaurant closed at 10 p.m how can be in a five star hotel??"
"recently, I visited this hotel twice and while it might be aging a little I remain impressed with the landscaping, the service and the facilities. Excellent place to visit with kids, they like the swimming pool and the breakfast buffet which is abundant and of good quality"
"Very good impression when you arrive! Nice entrance, friendly teams, great view on the golf course.  Good breakfast!  That&#39;s it! Rooms are simply depressing! Old, old, old... The rest of the hotel can be nice but let me remind you (if it was necessary) that the most important feature of a hotel is its rooms... I am not gonna sleep at the pool or on the lovely grass of the golf course. I will sleep in the bedroom, take my shower in the bathroom and spend minimum 35% of my day n night in the room! One more thing: Hyatt is certainly one of the last of its species to still charge for internet in your room...  Not recommended!"
"A well set hotel, that provides good care to its guests. Rooms are clean and well appointed. Good service. The choice of vegetarian spread is very limited. Perhaps that can be the only blemish, if at all. The hotel is set inside from the main road, and is peaceful. A wide verity of activities Golf, tennis etc, available."
"You can tell that this hotel was the bomb about ten years ago, and it is still very nice, but starting to show its age.  It is maintained pretty well, but will soon need a complete renovation if the owners want it to remain a deluxe Hyatt resort.  The rooms are clean, but a little worn.  The grounds around the resort are gorgeous.  The pool is great, but needs a little renovation as well.  As it is, it is a very good hotel that used to be a super fancy, high end hotel.  I would not hesitate to stay here again if the price is good ($100 USD/night or less).  If they do a complete renovation, expect it to be 3x that price."
"the Hyatt Regency Yogja doesnot hold a candle to the other Hyatt properties around the world. It needs a renovation today and many facilities are non-existence. the only reason i have given them a &quot;very good&quot; review is because most of the staff there is genuinely helpful and the property itself is beautiful with its open lush lawns, water features and borobudur inspired architect  Positives: 1. beautiful property 2. genuinely affectionate staff and extremely helpful 3. they gave me a complimentary cake for my birthday (which my husband organised) but also showered me with beautiful bouquets of flowers and cards (which my husband did not organise and says should have taken the credit for anyways)  4. great setting for the ramayana ballet 5. free wifi  not so positive: 1. the</span><span>&hellip;"
"However it wasn&#39;t that great. I stayed with my mum and sister for 2 nights during the new year holiday. Indeed it is a good hotel with great facilities such as swimming pool, pond, jogging track, andong (horse cart) touring, outbound activities for family, etc. I had fun swimming and sunbathing in their pool.  But I must say that their service isn&#39;t great. First, they didn&#39;t give us any info to book the andong village tour. When I ask about it they just said that I can go directly to ball desk and wait for it there. They should&#39;ve told me that I need to book the tour by giving them the hour I wanna do the andong tour and my room number :/  Second, during the breakfast buffet. I have the feeling they lack of staff for the holiday season as I almost got into a fight to get nasi</span><span>&hellip;"
"We recently visited Jogjakarta to see the sites, and stayed at the Hyatt Regency.  It is a nice hotel, with good facilities - nice pool area, green open spaces, golf course. However the service is poor. The staff, whilst friendly, are slow and inattentive. The restaurants have potential, as the food is tasty - but almost every meal we ate arrived cold. We paid for the Club Rooms, which gave access to the Club Lounge which is definitely a good option, but the staffing in the Club Lounge are ineffectual to issues raised. The Club Rooms are nice, with access to the grounds, and breakfast is good. Generally a decent option within Jogja, but management need to seriously look at their staffing."
"Staying this hotel for 3 consecutive nights, this hotel was very nice to stay. Garden and Golf-Field was very wide to explore. Jogging track quite distance and very nice to try.  Although the building seemed not new (I thought this was build in 80&#39;s-90&#39;s), but kept well. Very clean and was memorable to stay in this hotel. Couple years ago, traffic this hotel was not too crowded, but nowadays, as traffic increased, trapped in traffic lights, force us to take some time to reach into this hotel. Try to swim at pool and feel the difference..  Food also good in general. Vary for vegetarian to normal breakfast. Very recommend to stay to this hotel."
"What a pleasure to see a resort hotel and its staff to step up to social responsibility and support a noble cause such as Brest Cancer awareness.   The work that was put forth by directors and entire staff of Hyatt to organize and support the two days Pink Ribbon event was extremely touching.   There were awareness speeches, fashion show and a fantastic dance completion by local children.   The competition was kicked off by GM of Hyatt and its directors doing an impromptu Dane themselves which received lot of applause and laughter.    The Hyatt team raised a lot of awareness and funds for a very worthy cause.  Love your women and save them.    This is what makes living  in Hyatt worth it! "
"I have stayed at the Hyatt Regency in Yogyakarta many times and we have used it for VIP guests as well, always to our satisfaction. As well we have often hosted small to medium size high level conferences there. The hotel&#39;s location and design are quite breathtaking - in the northern part of the city with superb views of Mt Merapi and surrounded by greenery thanks to its 9 hole golf course. The design is inspired by the famous Borobudur Buddhist temple, and rises in concentric levels but it is small in scale. It has easy access to the centre of the city (20 minutes).  On the main road in front of the hotel has grown up an excellent &quot;restaurant row&quot; - so within a a few hundred meters are many new restaurants which staff can recommend to you. Off hand, I can recommend IBC (family</span><span>&hellip;"
"We stayed here for 2 nights - not long enough. The location is relatively far from the city center, but you get the tranquility and the view. It&#39;s only 30 minute drive from the airport. All guests are.given a fragrant jasmine garland upon arrival. Walking to the lobby you will be treated with a beautiful view of Mt Merapi. The hotel&#39;s premise is huge. It has a golf course, swimming pool and spa, separate building for conference &amp; meeting rooms.  The room is relatively small compared to other new 5* hotels&#39; and the furnitures are dated. But the room is very clean, well maintained. The bathroom is clean and nice. The bed is very comfortable and there are plenty of pillows. Breakfast was fantastic. So many sumptuous choices: local and western, healthy and otherwise, great selection</span><span>&hellip;"
"The hotel not only has very nice view to Merapi mountain but also has large garden and golf course. Choose the North side of room is better, because we can directly see Merapi mountain.  Breakfast is excellent, a lot of choice"
"Set in stunning surroundings, this could become a really nice hotel if only they spent a bit more money in smartening up the rooms and restaurants.  What I liked: 1. Very nice staff. Great service with a smile. 2. Beautiful premises. Great looking gardens, lush golf course, long and winding pool. 3. Quiet surroundings and the comfortable bed made for great sleep quality.   What was not so great: 1. Average quality of food. Breakfast buffet had a wide spread, but nothing stood out. Likewise the a la carte options. 2. Rooms were a bit dated and tired. The bathroom and furnishings need freshening up.  What I did not like: 1. Location. Away from town, nothing of interest nearby. 2. Beautiful pool, but dirty on both occasions I ventured for a swim. 3. Patchy wifi connectivity in the</span><span>&hellip;"
"We stayed for 2 nights at Hyatt and its a nice hotel. The staff is very friendly and helpful. At the restaurant we were treated royally. The service is superb! Since we are vegetarians, we explained what we could have and the staff &amp; chef came up with some tasty options. The rooms could have been a little bigger and they look a little worn out. But considering Jogja, it is one of the good properties to stay. Overall, we had a good experience staying in this hotel."
"This is our second time stay in Hyatt Jogja... And expected, everything is perfect from the time we enter the hotel until the last minutes ... Kids love the pool, the fishing pond and cycling the golf area.  We take the club room free access to the club area and afternoon coctail.  Breakfast and dinner are served very well with wide variety of local and international menu  Staff are very helpfull and they take care my kids very well.  "
"I never been to this property before and yet they treated me like I was their long-time-no-see friend. I was impressed by their flexibility and their agility on handling all my needs. Their property was built in 1997, although their property seems old, but the atmosphere was spot-on. It was so unfortunate I didnt bring my family along because this property will be a great place to have a quality time with your family. Foods were excellent. They have lagoon pool, it will fit for those with kids. They also have a 9-hole golf resort, you can rent golf sticks and it&#39;s affordable. One thing that bugging me was that their internet connectivity is come and go and you have to pay extra to get high-speed connection. But overall, this property is great and I will definitely go back.  "
"I really like this hotel, a comfortable and green hotel with touch of traditional heritage of Java. There&#39;s facility of andong and bicycle from and around hotel. The food is quite good and the weather is beautiful here."
"I stayed for 3 nights at Hyatt Yogyakarta during company conference.   The hotel is very big and has many facilities; swimming pool, fitnes center, spa and even golf.  The room was ok and amenities were fine.  Staffs were helpful and friendly.  Breakfast was good with a lot of varieties.  However, I can tell that the hotel is showing its age.  Bedsheet was not clean and had some stain, bed was not comfortable and hard.  Water pressure was not good and hot water was sometimes not working during my stay.  Bathtub was old style and very slippery.  They should consider removing the bathtub, or at least put a mat.  It were so dangerous, I almost felt whenever I showered.  Hyatt Yogyakarta was definetely very grand in the past.  However, I would not consider it, if I visit Yogyakarta</span><span>&hellip;"
"I stayed at the Hyatt for a week and a half.  I&#39;d originally tried to make a reservation for my entire 5-week stay, but I&#39;m actually glad they didn&#39;t have space.  Pros:  The staff were extremely nice, without a doubt the best part of my stay.  They really made me feel very welcome, to the point that I feel terrible for writing a negative review.  The manager, Nur, went out of his way to sit down with me and recommend places to visit in the area.  Other members of the staff were also really, really nice.    The landscaping was beautiful.  If you&#39;re looking for a relaxing oasis from the loud, dirty city, you definitely feel that when you get to the hotel.  In the room, the bed was really comfortable.  Though the hotel was fully booked on many of the days I was there, I never</span><span>&hellip;"
"Went on a Mother and daughters trip . 3 of us had super fun holiday . The Staffs were extremely friendly and kind.   The staffs at the regency club floor were efficient and kind   The food at restaurant were delicious and good deal . ( If compare to Singapore ) . Breakfast had lots of variety for you to enjoy .  Swimming pool was great . Clean , and relax."
"Such a beautiful hotel built like Borobudur and with little stupas dotting the entrance. Has a tranquil and serene ambience with lotus flowers blooming. We were checked into the club regency rooms within five minutes. But we had to wait for two rooms out of the four to be vacated as the guests had not left on time. I was given an apology letter for that. They welcome you with Jasmine garlands and welcome drink in the Club Regency.  All four rooms had good views with two of swimming pool and garden and the other two had golf course views. Both were interconnecting rooms. Delicious snacks are served in the cocktail time in the evening.  The breakfast is sumptuous with Indonesian, Chinese and Continental food.  As our flight landed at 10.30am from Denpasar and check-in is at 3pm,</span><span>&hellip;"
"First staff were universally very good and committed to guest experience being positive , beyond this the guest experience was surprisingly and disappointingly poor.  Room was permeated by musty odour which rendered unpleasant to stay in, also infestation with small ants. Wi-fi to weak signal to use for any meaningful work in rooms.  Al-la- cart service from the kitchen at dinner was  grim, bread reaching &quot;maturity&quot; butter straight from freezer, overuse of garlic and chili rendered simple menu choices (cream soup steak and chips) a ghastly experience. No care and attention from the chefs, and this may in part be due to wedding and other functions sucking up all the effort, either way lack of quality control and supervision (waiting staff were good) Breakfast was curtailed when</span><span>&hellip;"
"I have been there right after such a productive business trip purpose in Semarang. 4 hours over the land trip was paid off once I decided to check in at Hyatt Regency.  The ancient arcithecture of the well-known Borobudur statue is a thing that catched-up my attention the most. Greenery was there to get your eyes relaxed and so is your feeling. Rooms, staff, and the early check-in process was a real smooth. I swam and enjoyed all the greens by walking around the resort. I loved the breakfast and I think it should be a little nicer to improve some menus in the buffet breakfast.  Overall, my Jogja experience is best with Hyatt!"
Arriving late and then only staying one night is a shame in this beautiful hotel. Being welcomed with a Yasmin necklace has been a nice touch being on a business trip.   Staying there for a one day event in the hotel was nice. The room was spacious with a great view into the park. The restaurant looks over the pool and depending on the weather you can sit inside or outside.   The food was excellent and the Internet connection sufficiently fast to get some work done. Wish I could have stayed a bit longer.
"The hotel is super clean and well maintained, even by Western standards.  The Pool is where this hotel really stands out -- waterslides, basketball, great lounge chairs, bar service, etc.  The club level rooms are great.  Free coffee, snacks and happy hour along with an amazing breakfast buffet.  For other amenities, there is a gym but it&#39;s a bit small.  Golf and other activities look great but I&#39;m not sure who can stand to enjoy these activities in 95 degree humid Indonesian weather.  The Spa / Locker room feels (smells...) a bit dirty.  The massages offered here are ok, not great.  More of the relaxing style than deep tissue stress relief.  I ate at the hotel several times.  The food here is good, not great.  The staff at the cafes are very friendly and make an effort to learn</span><span>&hellip;"
"We booked a Club room and when we arrived, we were escorted to the Club Lounge and were quickly checked-in. Everyone was friendly and helpful. The hotel has a real big pool with a water slide which the kids loved. Rooms are clean and doesn&#39;t look as old as what some reviews say. Within the hotel, there is a travel agent that provide very reasonable rate to hire a car with driver to go wherever you want. Massages at the spa was good and at very reasonable prices too. Must visit Prabanam and Borobudor."
"Hyatt was one of the top choice for hotel in jogjakarta for my big family. My uncle and cousin usually stay at hyatt during their holiday in Jogjakarta. But I never go there until last August.  I must say that they have one of the most unique welcome ceremony in jogjakarta, you will be greeted with flower necklace put on you by their friendly employee. Welcome drink and warm towel also provided. It was very nice experience.  They also offer program like cooking class for those who want to fill their holiday with unique things to do. They have several pools also, quite nice for kids.   One thing though, i guess part of the room need refreshment, otherwise it could be easily 5 stars."
"I usually stay this hotel. The room is nice and well maintained always. Especially bed Linen is very comfortable. They have a lot of facilities such as golf course,tennis with instructor,spa,big pool. The restaurant also serve us nice meal.My favorite is pizza with double cheese !   Finally, let me nominate Ms.CITRA (at restaurant) for a best staff awards at this hotel. She always serve promptly and catch what I need.  I appreciate your service spirits !  Check in_Oct,28 - out Oct,31,2014"
"The hotel staff really makes you feel special! When we arrived we were greeted with flower leis, cold drinks and towels. The purpose of our visit was to see the Borobudur Temple which the hotel arranged for us. Our guide as really great and we would highly recommend! We did the half day city tour one day - which was really interesting and informative. Then the next day the same guide took us to Borobudur (which is about an hour drive). We are so happy that we had the hotel arrange this for us. The pool is gigantic as were the grounds. There are beautiful trees and flowers everywhere you looked. The breakfast was plentiful and would suit everyones needs. We ate dinner here a few times as well and the food was really good and not terribly expensive. The room was a nice size and</span><span>&hellip;"
"My girlfriend and I stayed here for three nights and honestly almost everything was amazing! The atmosphere everywhere in the hotel is great, the garden and swimming pools are a real paradise, the breakfast is overwhelming and very good, the dinner location is very romantic under the trees and the food is very good. The room we had was big, luxury, comfortable, clean and had great views at the garden. The staff was very friendly and helpful. From the moment we entered the hotel we felt at home and totally relaxed. The only room for improvement we see is the spa. The treatments we had were okay, but not in line with the rest of the hotel and the spa itself looks a bit outdated and also not in line with the rest of the hotel. We would definetely recommend this hotel to others, we</span><span>&hellip;"
"I would have never dreamed I&#39;d give a Hyatt property 5 stars but this one is a real gem. This hotel was utterly fabulous from the moment we arrived until the moment we left. In fairness  I haven’t stayed at more than a dozen Hyatt’s but they&#39;ve rarely surpassed 3 stars in my opinion. This property is gorgeous. It is a phenomenal blend of historic, traditional and contemporary architecture, landscaping, design, decor and furnishing. Each and every staff member we interacted with was nothing short of spectacular. Everyone was very polite, attentive, helpful, engaging and friendly. Concierge, greeters, security, club staff, bellman, housekeeping, valet, restaurant staff, business center &amp; manager were all wonderful. They made us feel very welcome and appreciated. Special. My wife &amp;</span><span>&hellip;"
"We stayed at Hyatt Regency Yogya for 2 nights as we attended training. The Hyatt Regency land area is huge and connected to golf course at the back of the hotel. We had a plesant stay and the service is superb. The meeting room is also good. However we want to suggest that the food spread for breakfast and lunch need to be improved by adding more varieties. Lastly, we noted that in some outdoor areas the mosquitos are quiet a lot and i am sure that the management of the hotel has done something to it. Perhaps regular spray can be added. Cheers"
"Every staff member at the hotel is delightfully genuine in wanting to help &amp; ensure guests have a fabulous visit.  The Club Rooms are stunning value, although we moved up to a (slightly) smaller 6th floor room with private terrace at no extra charge. Long breakfasts beside the pool.  A delightfully jumbled pool with lots of spots to get away from everybody else.  Awesome spa treatments. The bursts of Japanese tour groups were barely a blip disturbing the overall peace &amp; tranquility."
"Clean, well maintained hotel with lots of activities for couples, kids and family. Resort has several activities to keep you within their walls such as football, golf, climbing, wall soccer, cycling etc. Free ride to malioboro street but avoid it by all means, boring shopping street. Rooms lacked a shower cabin.  Spa was awesome and restaurant has several varieties. It is everything you would expect from a star resort. Looking for a safe branded option for your holiday is your kinds, then you would love this."
"This Hyatt Regency is really an amazing and complete resort. Located on the main road that leads to the slope of Mt. Merapi, which one of the most active volcanoes in the world, it is only approximately 45 minutes away from the world renowned, UNESCO World Heritage Site, Borobudur and Prambanan Temple complexes. The Yogyakarta Kraton / Palace located in downtown is only 15 minutes drive away. I love everything about this resort...... the well manicured gardens, the architecture (the main hotel building is build to mimick the famous Borobudur Temple), the pools, golf course, and most of all, the professional and utterly charming staff and the services they rendered. Guest room is the not the biggest nor boast the most up to date decor but has all the necessary amenities. It is</span><span>&hellip;"
"In the chaotic atmosphere of Yogya, with its trillion motorcycles, the HR is a welcoming enclave of peaceful quietness and luxury. Somewhat classic business hotel, still nice for a short family, vacation stay on your way to other destinations. Good traditional rooms. Good restaurant. Nice swimming pool. And a good base camp to visti Borobudur, Prambanan and the city centre."
"It is a Javanese themed resort hotel all under one roof; swimming pool for grown-ups &amp; kids, 9-hole golf course, Spa wellness centre, local tour &amp; a lushful garden picturesque. The staffs are very friendly &amp; helpful not to mention especially the asst. Front Desk manager Pak Yanuar &amp; his staff Ms. Sus. The tour desk is very helpful &amp; knowledgeable too. The rooms are okay, but a bit small compared to other Hyatt hotels in Indonesia. Breakfast is superb, must try the pancakes &amp; waffles. Every Saturday night, there is a Ramayana arts performance at the hotel  grounds with buffet dinner. Wonderful event and lighting &amp; surroundings. Very special and worth the money. A must try experience. Will stay in the hotel again if ever have the chance to visit Yogyakarta again."
